{
  "requestId": "run-request_my_batch_decision",
  "operatorId": "local.operator",
  "workMode": "autopilot",
  "inputMode": "manual-list",
  "inputRefs": [
    {
      "kind": "source-file",
      "ref": "../inputs/my-batch.csv",
      "notes": "Real local batch for decision-only run."
    }
  ],
  "executionBoundary": "decision",
  "safeLimits": {
    "maxLeads": 10,
    "maxPagesPerLead": 3
  },
  "operatorNotes": "Real local batch. Stop after decision artifacts.",
  "createdAt": "2026-03-31T12:00:00Z"
}
